<?xml version="1.0" encoding="UTF-8"?>
<campeonatos xmlns:xsi="http://www.w3.org/2001/XMLSchema-instance"
 xsi:noNamespaceSchemaLocation="file:/C:/Users/Cassio/Documents/git/banco_de_dados_II-campeonato_brasileiro/banco_de_dados_II-trabalho2/campeonato.xsd">
 <campeonato id="1">
  <ano>2017</ano>
  <nroClubes>1</nroClubes>
  <clubes>
   <clube id="50" nome="Internacional">
    <jogador id="1" idPosicao="1"/>
    <jogador id="2" idPosicao="1"/>
    <jogador id="3" idPosicao="1"/>
    <jogador id="4" idPosicao="1"/>
    <jogador id="5" idPosicao="1"/>
    <jogador id="6" idPosicao="1"/>
    <jogador id="7" idPosicao="1"/>
    <jogador id="8" idPosicao="1"/>
    <jogador id="9" idPosicao="1"/>
    <jogador id="10" idPosicao="1"/>
    <jogador id="11" idPosicao="1"/>
    <jogador id="12" idPosicao="1"/>
    <jogador id="13" idPosicao="1"/>
    <jogador id="14" idPosicao="1"/>
    <jogador id="15" idPosicao="1"/>
    <jogador id="16" idPosicao="1"/>
    <torcidaOrganizada nome="Camisa 12" id="1"/>
    <tecnico nome="Celso Roth" id="1"/>
    <diretores>
     <diretor nome="Vitorio Piffero" id="1"/>
    </diretores>
    <patrocinadores>
     <patrocinador nome="Banrisul" id="1"/>
     <patrocinador nome="Nike" id="2"/>
    </patrocinadores>
    <posicoes>
     <posicao nome="Zagueiro" id="1"/>
    </posicoes>
   </clube>
  </clubes>
  <rodadas id="1">
   <jogos idCampeonato="1" idRodada="1" idClube1="1" idClube2="1" id="1">
    <clube1Gol>50</clube1Gol>
    <clube2Gol>50</clube2Gol>
    <clube1Ponto>50</clube1Ponto>
    <clube2Ponto>50</clube2Ponto>
    <clube1Amarelo>50</clube1Amarelo>
    <clube2Amarelo>50</clube2Amarelo>
    <clube1Vermelho>50</clube1Vermelho>
    <clube2Vermelho>50</clube2Vermelho>
   </jogos>
   <jogos idCampeonato="1" idRodada="50" idClube1="1" idClube2="1" id="50">
    <clube1Gol>1</clube1Gol>
    <clube2Gol>1</clube2Gol>
    <clube1Ponto>50</clube1Ponto>
    <clube2Ponto>50</clube2Ponto>
    <clube1Amarelo>50</clube1Amarelo>
    <clube2Amarelo>50</clube2Amarelo>
    <clube1Vermelho>50</clube1Vermelho>
    <clube2Vermelho>50</clube2Vermelho>
   </jogos>
   <classificacoesRodadas>
    <classificacaoRodada id="1" idCampeonato="50" idRodada="50" posicao="50" idClube="50"/>
   </classificacoesRodadas>
  </rodadas>
  <classificacoesGerais>
    <classificacaoGeral id="1">
        <posicaoClassificacao>1</posicaoClassificacao>
        <idClube>1</idClube>
      </classificacaoGeral>
   </classificacoesGerais>
 </campeonato>
</campeonatos>

